{
  "$schema": "https://json-schema.org/draft/2020-12/schema",
  "$id": "https://raw.githubusercontent.com/falsable/a2dlc/main/contracts/backtranslation.schema.json",
  "title": "Blind back-translation of S* (.a2dlc/run/<slice>/backtranslation.json)",
  "description": "Stage 1.5 step 5 (§5): the Back-translator reads only contract.json (S* with π_S inside), without the intent or the specifiers' reasoning, and writes in natural language what the slice does according to S*: what the contract allows and what it forbids. The core saves it with the hash of the contract that was translated. Matching the intent proves nothing (§10.1); not matching opens a review.",
  "type": "object",
  "properties": {
    "schema_version": { "$ref": "defs.schema.json#/$defs/schema_version" },
    "slice_id": { "$ref": "run-defs.schema.json#/$defs/slice_id" },
    "contract_hash": { "$ref": "run-defs.schema.json#/$defs/sha256" },
    "prose": { "type": "string", "minLength": 1 },
    "examples": {
      "description": "Concrete assertions, one per entry: an input and what S* says happens, or something S* forbids.",
      "type": "array",
      "items": { "type": "string", "minLength": 1 }
    }
  },
  "required": ["schema_version", "slice_id", "contract_hash", "prose", "examples"],
  "additionalProperties": false
}
