{
 "schema_version": 1,
 "slice_id": "calc.media.v1",
 "contract_hash": "sha256:3a7bd3e2360a3d29eea436fcfb7e44c735d117c42d1c1835420b6b9942dd4f1b",
 "prose": "media takes a list of finite floats and returns its arithmetic mean without modifying it. With an empty list it raises ValueError. Two results that differ by less than 1e-9 relative count as equal.",
 "examples": [
  "media([2.5]) devuelve 2.5",
  "media([]) lanza ValueError",
  "media([1.0, 2.0]) and media([2.0, 1.0]) count as the same result"
 ]
}
